{
  "schema": "pqc/character@1",
  "id": "ilsevel",
  "name": "Ilsevel Starwick",
  "player_facing_title": "Lamplighter Archivist",
  "species": "elf",
  "lineage": "high_elf",
  "size": "medium",
  "class": "wizard",
  "subclass": null,
  "level": 1,
  "xp": 0,
  "background": "sage",
  "deity": null,
  "base_scores": {
    "str": 8,
    "dex": 14,
    "con": 13,
    "int": 15,
    "wis": 12,
    "cha": 10,
    "background_bonus": {
      "int": 2,
      "con": 1
    }
  },
  "abilities": {
    "str": 8,
    "dex": 14,
    "con": 14,
    "int": 17,
    "wis": 12,
    "cha": 10
  },
  "hp": {
    "max": 8,
    "current": 8,
    "temp": 0
  },
  "hit_dice": {
    "die": 6,
    "max": 1,
    "current": 1
  },
  "speed": 30,
  "darkvision": 60,
  "equipment": {
    "armor": null,
    "shield": false,
    "weapons": [
      "dagger",
      "quarterstaff"
    ],
    "focus": "lantern_pole_staff"
  },
  "skill_proficiencies": [
    "arcana",
    "history",
    "investigation",
    "insight",
    "perception"
  ],
  "expertise": [],
  "tool_proficiencies": [
    "calligraphers_supplies"
  ],
  "weapon_proficiencies": [
    "simple"
  ],
  "armor_proficiencies": [],
  "languages": [
    "common",
    "elvish",
    "draconic",
    "sylvan"
  ],
  "feats": [
    "magic_initiate_wizard"
  ],
  "features": [
    "spellcasting",
    "ritual_adept",
    "arcane_recovery"
  ],
  "feature_names": [
    "Spellcasting",
    "Ritual Adept",
    "Arcane Recovery"
  ],
  "traits": [],
  "weapon_masteries": [],
  "resistances": [],
  "immunities": [],
  "vulnerabilities": [],
  "condition_immunities": [],
  "resources": {
    "arcane_recovery": {
      "max": 1,
      "current": 1,
      "recharge": "long"
    }
  },
  "spellcasting": {
    "ability": "int",
    "cantrips": [
      "fire_bolt",
      "ray_of_frost",
      "mage_hand",
      "prestidigitation",
      "light",
      "shocking_grasp"
    ],
    "prepared": [
      "magic_missile",
      "shield",
      "burning_hands",
      "mage_armor"
    ],
    "spellbook": [
      "burning_hands",
      "detect_magic",
      "mage_armor",
      "magic_missile",
      "shield",
      "thunderwave"
    ],
    "slots": {
      "1": {
        "max": 2,
        "current": 2
      }
    },
    "free_casts": {
      "find_familiar": {
        "max": 1,
        "current": 1
      }
    }
  },
  "inventory": [
    {
      "id": "spellbook",
      "qty": 1
    },
    {
      "id": "dagger",
      "qty": 1
    },
    {
      "id": "potion_of_healing",
      "qty": 1
    },
    {
      "id": "ink_and_quill",
      "qty": 1
    },
    {
      "id": "ysolde_spectacles",
      "qty": 1,
      "note": "Brass, round, non-prescription"
    },
    {
      "id": "unsent_letters",
      "qty": 132,
      "note": "SECRET until C3"
    },
    {
      "id": "lamplighter_writ",
      "qty": 1
    }
  ],
  "money_cp": 1000,
  "heroic_inspiration": false,
  "dossier": "dossiers/ilsevel.md",
  "level_history": [],
  "conditions": {},
  "effects": [],
  "exhaustion": 0,
  "death_saves": {
    "successes": 0,
    "failures": 0
  },
  "stable": false,
  "dead": false,
  "concentration": null
}