{
  "schema": "pqc/character@1",
  "id": "brannoc",
  "name": "Brannoc Ironvow",
  "player_facing_title": "Exiled Soldier",
  "species": "dwarf",
  "lineage": null,
  "size": "medium",
  "class": "fighter",
  "subclass": null,
  "level": 1,
  "xp": 210,
  "background": "soldier",
  "deity": "vigrun",
  "base_scores": {
    "str": 15,
    "dex": 13,
    "con": 14,
    "int": 8,
    "wis": 12,
    "cha": 10,
    "background_bonus": {
      "str": 2,
      "con": 1
    }
  },
  "abilities": {
    "str": 17,
    "dex": 13,
    "con": 15,
    "int": 8,
    "wis": 12,
    "cha": 10
  },
  "hp": {
    "max": 13,
    "current": 13,
    "temp": 0
  },
  "hit_dice": {
    "die": 10,
    "max": 1,
    "current": 1
  },
  "speed": 30,
  "darkvision": 120,
  "equipment": {
    "armor": "chain_mail",
    "shield": true,
    "weapons": [
      "longsword",
      "javelin"
    ]
  },
  "skill_proficiencies": [
    "athletics",
    "intimidation",
    "perception",
    "survival"
  ],
  "expertise": [],
  "tool_proficiencies": [
    "dice_set"
  ],
  "weapon_proficiencies": [
    "simple",
    "martial"
  ],
  "armor_proficiencies": [
    "light",
    "medium",
    "heavy",
    "shields"
  ],
  "languages": [
    "common",
    "dwarvish"
  ],
  "feats": [
    "savage_attacker",
    "fighting_style_defense"
  ],
  "features": [
    "fighting_style",
    "second_wind",
    "weapon_mastery"
  ],
  "feature_names": [
    "Fighting Style (Defense)",
    "Second Wind",
    "Weapon Mastery"
  ],
  "traits": [],
  "weapon_masteries": [
    "longsword",
    "javelin",
    "battleaxe"
  ],
  "resistances": [
    "poison"
  ],
  "immunities": [],
  "vulnerabilities": [],
  "condition_immunities": [],
  "resources": {
    "second_wind": {
      "max": 2,
      "current": 2,
      "recharge": "long",
      "short_rest_regain": 1
    }
  },
  "spellcasting": null,
  "inventory": [
    {
      "id": "javelin",
      "qty": 4
    },
    {
      "id": "potion_of_healing",
      "qty": 1
    },
    {
      "id": "rations",
      "qty": 5
    },
    {
      "id": "rope_hempen",
      "qty": 1
    },
    {
      "id": "sealed_dispatches",
      "qty": 1
    },
    {
      "id": "torch",
      "qty": 5
    },
    {
      "id": "whittling_knife",
      "qty": 1
    }
  ],
  "money_cp": 2450,
  "heroic_inspiration": false,
  "dossier": "dossiers/brannoc.md",
  "level_history": [],
  "conditions": {},
  "effects": [],
  "exhaustion": 0,
  "death_saves": {
    "successes": 0,
    "failures": 0
  },
  "stable": false,
  "dead": false,
  "concentration": null
}
