{
  "schema": "pqc/character@1",
  "id": "oriel",
  "name": "Oriel Ashdown",
  "player_facing_title": "Acolyte of the Open Hand",
  "species": "human",
  "lineage": null,
  "size": "medium",
  "class": "cleric",
  "subclass": null,
  "level": 1,
  "xp": 74,
  "background": "acolyte",
  "deity": "aurelan",
  "base_scores": {
    "str": 13,
    "dex": 10,
    "con": 14,
    "int": 8,
    "wis": 15,
    "cha": 12,
    "background_bonus": {
      "wis": 2,
      "cha": 1
    }
  },
  "abilities": {
    "str": 13,
    "dex": 10,
    "con": 14,
    "int": 8,
    "wis": 17,
    "cha": 13
  },
  "hp": {
    "max": 10,
    "current": 10,
    "temp": 0
  },
  "hit_dice": {
    "die": 8,
    "max": 1,
    "current": 1
  },
  "speed": 30,
  "darkvision": 0,
  "equipment": {
    "armor": "chain_mail",
    "shield": true,
    "weapons": [
      "warhammer"
    ],
    "focus": "holy_symbol"
  },
  "skill_proficiencies": [
    "insight",
    "religion",
    "medicine",
    "persuasion",
    "perception",
    "athletics",
    "performance",
    "survival"
  ],
  "expertise": [],
  "tool_proficiencies": [
    "calligraphers_supplies"
  ],
  "weapon_proficiencies": [
    "simple",
    "martial"
  ],
  "armor_proficiencies": [
    "light",
    "medium",
    "heavy",
    "shields"
  ],
  "languages": [
    "common",
    "halfling",
    "celestial"
  ],
  "feats": [
    "magic_initiate_cleric",
    "skilled"
  ],
  "features": [
    "spellcasting",
    "divine_order_protector"
  ],
  "feature_names": [
    "Spellcasting",
    "Divine Order (Protector)"
  ],
  "traits": [],
  "weapon_masteries": [],
  "resistances": [],
  "immunities": [],
  "vulnerabilities": [],
  "condition_immunities": [],
  "resources": {},
  "spellcasting": {
    "ability": "wis",
    "cantrips": [
      "sacred_flame",
      "guidance",
      "thaumaturgy",
      "spare_the_dying",
      "resistance"
    ],
    "prepared": [
      "cure_wounds",
      "healing_word",
      "bless",
      "guiding_bolt"
    ],
    "slots": {
      "1": {
        "max": 2,
        "current": 0
      }
    },
    "free_casts": {
      "sanctuary": {
        "max": 1,
        "current": 1
      }
    }
  },
  "inventory": [
    {
      "id": "brass_button",
      "qty": 1
    },
    {
      "id": "candle",
      "qty": 6
    },
    {
      "id": "healers_kit",
      "qty": 1
    },
    {
      "id": "holy_symbol",
      "qty": 1
    },
    {
      "id": "holy_symbol_tobin",
      "qty": 1
    },
    {
      "id": "hymnal",
      "qty": 1
    },
    {
      "id": "potion_of_healing",
      "qty": 1
    }
  ],
  "money_cp": 500,
  "heroic_inspiration": true,
  "dossier": "dossiers/oriel.md",
  "level_history": [],
  "conditions": {},
  "effects": [],
  "exhaustion": 0,
  "death_saves": {
    "successes": 0,
    "failures": 0
  },
  "stable": false,
  "dead": false,
  "concentration": "bless"
}
