{
  "schema": "pqc/character@1",
  "id": "tamsin",
  "name": "Tamsin Underbough",
  "player_facing_title": "Card Sharp (allegedly)",
  "species": "halfling",
  "lineage": null,
  "size": "small",
  "class": "rogue",
  "subclass": null,
  "level": 1,
  "xp": 74,
  "background": "criminal",
  "deity": "quill",
  "base_scores": {
    "str": 8,
    "dex": 15,
    "con": 14,
    "int": 10,
    "wis": 12,
    "cha": 13,
    "background_bonus": {
      "dex": 2,
      "con": 1
    }
  },
  "abilities": {
    "str": 8,
    "dex": 17,
    "con": 15,
    "int": 10,
    "wis": 12,
    "cha": 13
  },
  "hp": {
    "max": 10,
    "current": 7,
    "temp": 0
  },
  "hit_dice": {
    "die": 8,
    "max": 1,
    "current": 1
  },
  "speed": 30,
  "darkvision": 0,
  "equipment": {
    "armor": "leather",
    "shield": false,
    "weapons": [
      "shortsword",
      "shortbow",
      "dagger"
    ]
  },
  "skill_proficiencies": [
    "stealth",
    "sleight_of_hand",
    "acrobatics",
    "deception",
    "perception",
    "persuasion"
  ],
  "expertise": [
    "stealth",
    "sleight_of_hand"
  ],
  "tool_proficiencies": [
    "thieves_tools"
  ],
  "weapon_proficiencies": [
    "simple",
    "shortsword",
    "rapier",
    "scimitar"
  ],
  "armor_proficiencies": [
    "light"
  ],
  "languages": [
    "common",
    "halfling",
    "thieves_cant"
  ],
  "feats": [
    "alert"
  ],
  "features": [
    "expertise",
    "sneak_attack",
    "thieves_cant",
    "weapon_mastery"
  ],
  "feature_names": [
    "Expertise",
    "Sneak Attack",
    "Thieves' Cant",
    "Weapon Mastery"
  ],
  "traits": [],
  "weapon_masteries": [
    "shortsword",
    "shortbow"
  ],
  "resistances": [],
  "immunities": [],
  "vulnerabilities": [],
  "condition_immunities": [],
  "resources": {},
  "spellcasting": null,
  "inventory": [
    {
      "id": "arrows",
      "qty": 18
    },
    {
      "id": "dagger",
      "qty": 2
    },
    {
      "id": "gloamkey",
      "qty": 1
    },
    {
      "id": "marked_cards",
      "qty": 1
    },
    {
      "id": "potion_of_healing",
      "qty": 1
    },
    {
      "id": "thieves_tools",
      "qty": 1
    }
  ],
  "money_cp": 2385,
  "heroic_inspiration": false,
  "dossier": "dossiers/tamsin.md",
  "level_history": [],
  "conditions": {},
  "effects": [],
  "exhaustion": 0,
  "death_saves": {
    "successes": 0,
    "failures": 0
  },
  "stable": false,
  "dead": false,
  "concentration": null
}
